{
  "$schema": "../schema.json",
  "id": "0011-post-match-statistics",
  "type": "feature",
  "title": "Послематчевая статистика с графиками по ходу матча",
  "description": "После матча показывать красивую игровую статистику с временными рядами: как по ходу матча росло число башен и число юнитов у каждой стороны.\n\nЧто ещё показать — решить при проработке по тому, что реально есть в данных. Кандидаты: доход и накопленная энергия, потери с обеих сторон, урон по базе, время до первого столкновения, число ядерных ударов и их результат, доля времени в перевесе. Не выдумывать величины, которых в записи матча нет: график, нарисованный по догадке, хуже отсутствующего.\n\nЧто выяснить при проработке в первую очередь: хватает ли нынешней телеметрии и записи матча, чтобы построить ряды, или для этого придётся снимать новые отметки по ходу матча. Если снимать — то с шагом, который не утяжелит игровой цикл: главное нефункциональное требование проекта это отзывчивость, и ради красивого графика её не жертвуют.\n\nОтдельно: рисование графиков. В проекте своих средств для этого может не оказаться, а тянуть библиотеку ради одного экрана — решение, которое надо обосновать в проектном решении, а не принять походя.\n\nЗатрагивает `apps/client` (экран итогов), спецификации `match-telemetry` и `match-session`.",
  "status": "new",
  "returnTo": null,
  "priority": 50,
  "createdAt": "2026-08-27T13:05:00+03:00",
  "statusChangedAt": "2026-08-27T13:05:00+03:00",
  "owner": null,
  "history": [],
  "links": { "change": null, "pr": null, "run": null, "related": [] },
  "attempts": { "continuations": 0, "cycleFailures": 0 }
}
