{
  "$schema": "../schema.json",
  "id": "0035-sostav-voyska-ne-ispolnyaetsya-po-cene-4",
  "type": "feature",
  "title": "Состав войска не исполняется по цене: 48 к 1 при заявленном 1 к 1",
  "description": "В поздней фазе профиля long-range-2026-08 снайпер и Тесла объявлены равными весами 3 и 3, а за 60 матчей заказано 3099 снайперов и 65 Тесл. Причина в ценах: Тесла 250 энергии, снайпер 50, штурмовик 25 — выбирается то, что по карману, а не то, что заявлено. Пока это так, ни один профиль не может измерить поведение осадных машин, потому что их просто не строят. Смыкается с задачей про fix-ai-spending. Замечено на прогоне 33117319887.",
  "status": "design",
  "returnTo": null,
  "priority": 30,
  "createdAt": "2026-08-27T21:36:39.964Z",
  "statusChangedAt": "2026-08-28T02:58:43.640Z",
  "owner": "NB3391",
  "history": [
    {
      "at": "2026-08-28T02:58:43.640Z",
      "from": "new",
      "to": "design",
      "note": "взята в работу машиной NB3391"
    }
  ],
  "links": {
    "change": null,
    "pr": null,
    "run": null,
    "related": [
      "0008-unit-range-upgrade"
    ]
  },
  "attempts": {
    "continuations": 2,
    "cycleFailures": 0
  }
}
