{
  "$schema": "../schema.json",
  "id": "0025-find-a-real-nuke-fall-recording",
  "type": "note",
  "title": "Подобрать настоящую запись свиста падающей ядерной ракеты",
  "description": "ЭТО НАПОМИНАНИЕ ВЛАДЕЛЬЦУ ПРОДУКТА, А НЕ РАБОТА ДЛЯ МАШИНЫ. Задача заведена сразу в ожидании ответа и висит на доске в столбце «Ждут вас» намеренно: разбирать её нечего до тех пор, пока не появится файл.\n\nОТКУДА ОНА ВЗЯЛАСЬ. Задача 0023 убирает посчитанный свист снижающейся ракеты — он звучит неестественно. Замены нет, и до её появления ядерный удар подлетает молча. Молчание лучше фальши, но хуже правды: свист был единственным предупреждением об ударе, летящем в невидимую сейчас часть поля.\n\nЧТО НУЖНО ОТ ВЛАДЕЛЬЦА. Найти запись свиста или воя падающей ракеты, которую можно взять в проект. Требования выведены из устройства звука, описанного в `apps/client/src/audio/assets.ts`, а не придуманы.\n\n1. Формат mp3 — как у прочих записей проекта.\n2. Длительность около трёх секунд: столько длится `NUKE_DELAY_TICKS`, то самое время на реакцию, ради которого задержка и заведена. Короче — оборвётся до попадания, длиннее — придётся резать, а резать по границам кадров умеет не всякий редактор.\n3. Лицензия, позволяющая использование. Это единственное требование, которое машина проверить за вас не сможет вовсе.\n4. Вариант нужен ровно один. Правило проекта: частое синтезируется, редкое можно записью — ядерный удар случается за матч дважды, и повторяемость записи тут не мешает.\n\nКУДА КЛАСТЬ. `apps/client/src/audio/assets/nuke-fall.mp3`, рядом с `nuke-blast.mp3`.\n\nЧТО СДЕЛАЕТ КОНВЕЙЕР, КОГДА ВЫ ОТВЕТИТЕ. Задача вернётся в разбор. Разбирающая сессия проверит, появился ли файл, и заведёт заявку на задачу «вернуть звук снижающейся ракеты записью» — с обрезкой тишины в начале, приведением громкости и сглаживанием краёв, как того требуют три обязанности загрузчика записей.\n\nЧЕГО СЕССИЯ ДЕЛАТЬ НЕ ДОЛЖНА НИ ПРИ КАКИХ ОБСТОЯТЕЛЬСТВАХ. Искать звук в сети, скачивать файлы и решать вопрос о лицензии. Ответ на этот вопрос даёт человек.",
  "status": "awaiting-po",
  "returnTo": "triage",
  "priority": 90,
  "createdAt": "2026-08-27T18:23:00+03:00",
  "statusChangedAt": "2026-08-27T18:23:00+03:00",
  "owner": null,
  "history": [],
  "links": {
    "change": null,
    "pr": null,
    "run": null,
    "related": ["0023-drop-the-synthetic-nuke-whistle"]
  },
  "attempts": { "continuations": 0, "cycleFailures": 0 },
  "question": {
    "askedAt": "2026-08-27T18:23:00+03:00",
    "summary": "Нужна запись свиста падающей ядерной ракеты взамен посчитанного звука: какой файл берём или отказываемся от звука совсем.",
    "answeredAt": null
  }
}
