{
  "$schema": "../schema.json",
  "id": "0004-nuke-upgrade-strategist-strength",
  "type": "run",
  "title": "Сила Стратега после правки урона и радиуса ракеты",
  "description": "ядерный удар перестал стирать всё в круге: теперь он наносит 150 урона в радиусе четырёх клеток вместо десяти, и обе его ветки прокачки дают вдвое больше за уровень. Цена, радиус, урон и шаг прокачки изменились разом, и как это ляжет на исход матчей, покажет прогон, а не рассуждение. Смотреть прежде всего на «Стратега»: он единственный вкладывается в ракету, а вложенное в ракету не куплено на поле. Мерить придётся уже поверх tune-the-nuke (откат в минуту, цена пуска пять процентов за уровень) и поверх новой карты 38 × 38: правки уехали в main подряд и по отдельности уже не разделяются, поэтому запись начинает свою линию отсчёта, а не продолжает числа из предложения (18 ударов на 24 матчах при seed 3000–3023, старая карта)\n\nЗамер заказан по изменению «upgrade-nuke-damage-and-radius».\nВ очереди стояла отметка «до 2026-11-01».\n\nПеренесено из очереди проверок баланса `balance/queue.json` при её упразднении:\nочередью теперь служит сам бэклог, а прогоны — задачи типа `run`.\n\n**Замечено при переносе из очереди.** Настройка этой задачи совпадает\nбайт в байт с задачей-двойником: те же профили, то же число матчей, тот же\nseed. Журнал прогонов содержит по обеим одинаковые величины — то есть\nкаждую ночь гонялись одни и те же шестьдесят матчей дважды.\n\nВопросы у задач разные, а прогон один. Прежде чем гонять снова, решить:\nзакрывать ли обе одним прогоном, либо развести настройки так, чтобы каждая\nотвечала на свой вопрос — например, дать им разные зёрна.",
  "status": "benchmark",
  "returnTo": null,
  "priority": 30,
  "createdAt": "2026-08-27T13:32:34+03:00",
  "statusChangedAt": "2026-08-27T18:42:21.514Z",
  "owner": "NB3391",
  "history": [
    {
      "at": "2026-08-27T11:49:15.410Z",
      "from": "new",
      "to": "benchmark",
      "note": "взята в работу машиной NB3391"
    },
    {
      "at": "2026-08-27T14:53:25+03:00",
      "from": "benchmark",
      "to": "new",
      "note": "возвращена в очередь: захвачена при первом живом прогоне, когда исполнение шло мимо раскладки по слотам"
    },
    {
      "at": "2026-08-27T18:42:21.514Z",
      "from": "new",
      "to": "benchmark",
      "note": "взята в работу машиной NB3391"
    }
  ],
  "links": {
    "change": null,
    "pr": null,
    "run": null,
    "related": [
      "0006-fix-ai-spending-strategist-strength"
    ]
  },
  "attempts": {
    "continuations": 0,
    "cycleFailures": 0
  },
  "run": {
    "kind": "arena",
    "params": {
      "profiles": [
        "baseline-2026-08",
        "strategist-2026-08"
      ],
      "matches": 60,
      "seed": 3000,
      "change": "upgrade-nuke-damage-and-radius"
    },
    "expectation": "«Стратег» не проигрывает базовому профилю больше, чем в двух третях матчей: вложение в ядерные ветки должно окупаться уроном, а не оставлять его без войска. Медиана матча остаётся в проектной вилке 10–15 минут, доля упёршихся в предел времени не растёт. Профили намеренно РАЗНЫЕ: вопрос здесь о силе, а зеркальный матч об усилении не говорит ничего"
  }
}
