{
  "$schema": "../schema.json",
  "id": "0038-uborka-kataloga-progona-v-matchlog-otklo",
  "type": "note",
  "title": "Уборка каталога прогона в .matchlog отклоняется правилами разрешений",
  "description": "Скилл этапа benchmark предписывает убирать базу командой Remove-Item -Recurse -Force .matchlog/pipeline-<номер>, но в автономной сессии эта команда отклонена правилами разрешений. После прогона 33117319887 каталог .matchlog/pipeline-33117319887 с базой остался лежать. Путь игнорируемый, дерева он не грязнит, но занимает сотни мегабайт и накапливается с каждым прогоном. Нужно либо правило разрешений ровно на эту форму, либо другой способ уборки.",
  "status": "new",
  "returnTo": null,
  "priority": 60,
  "createdAt": "2026-08-27T21:36:39.964Z",
  "statusChangedAt": "2026-08-27T21:36:39.964Z",
  "owner": null,
  "history": [],
  "links": {
    "change": null,
    "pr": null,
    "run": null,
    "related": [
      "0008-unit-range-upgrade"
    ]
  },
  "attempts": {
    "continuations": 0,
    "cycleFailures": 0
  }
}
