{
  "$schema": "../schema.json",
  "id": "0036-perezamerit-prokachku-dalnosti-posle-poc",
  "type": "run",
  "title": "Перезамерить прокачку дальности после починки прибора и состава",
  "description": "Повторить прогон задачи 0008 теми же профилями и зерном после того, как арена начнёт писать гибель юнитов по типам и состав войска перестанет вырождаться в дешёвое. Линия отсчёта — прогон 33117319887: медиана 10:16, ничьих 13,3 %, Тесл 1,1 на матч у long-range, покупки дальности в 36,7 % матчей.",
  "status": "benchmark",
  "returnTo": null,
  "priority": 40,
  "createdAt": "2026-08-27T21:36:39.964Z",
  "statusChangedAt": "2026-08-27T22:56:09.772Z",
  "owner": "NB3391",
  "history": [
    {
      "at": "2026-08-27T22:56:09.772Z",
      "from": "new",
      "to": "benchmark",
      "note": "взята в работу машиной NB3391"
    }
  ],
  "links": {
    "change": null,
    "pr": null,
    "run": null,
    "related": [
      "0008-unit-range-upgrade"
    ]
  },
  "attempts": {
    "continuations": 1,
    "cycleFailures": 0
  },
  "run": {
    "kind": "arena",
    "params": {
      "profiles": [
        "baseline-2026-08",
        "long-range-2026-08"
      ],
      "matches": 60,
      "seed": 4300,
      "change": "add-unit-range-upgrade"
    },
    "expectation": "Ждём, что Тесл станет заказываться заметно больше одной на матч, иначе замер снова не состоится. Главное: доля потерянных Тесл у long-range ниже, чем у базового, а снятых вражеских башен на одну Теслу — выше; обе величины теперь берутся из записей гибели, а не из убыли снимков. Медиана матча остаётся в вилке 10–15 минут (линия отсчёта 10:16), доля матчей по времени не выше 13,3 %. Если Теслы гибнут не реже прежнего при том, что их наконец строят, ветка дальности не работает как задумано, и виновата либо цена дальности, либо то, что противник останавливается не там, где достаёт."
  }
}
