{
  "$schema": "../schema.json",
  "id": "0015-return-match-to-window-tempo",
  "type": "run",
  "title": "Вернулась ли длина матча в вилку после уменьшения запаса базы",
  "description": "запас базы уменьшен с пятисот базовых здоровий до четырёхсот. Правится не длина матча, а его исход: медиана и при пятистах оставалась в вилке (13:42 на сотне матчей), а вот треть партий кончалась истечением времени вместо разрушения базы. Сдвиг накопился за одни сутки из трёх правок сразу — войско стало останавливаться и снимать башни, у ядерного удара появился откат, место под башню стало оцениваться по живучести, — и регулируется их сумма, а не слагаемые. Уровень выбран развёрткой на пятистах матчах по пяти уровням запаса; двадцатью матчами выбрать было нельзя, длина матча распределена двугорбо и медиана двадцати пляшет на минуты. Здесь проверяется то же самое, но на чужой настройке и чужих зёрнах: совпадения чисел не ждём, ждём совпадения направления. Зерно намеренно не первое: запись compact-map-tempo уже гоняет зеркальную пару на зерне 1, и повторять её настройку значило бы платить шестьюдесятью матчами за второй прогон того же. На своих зёрнах это независимое свидетельство\n\nЗамер заказан по изменению «return-match-to-window».\nВ очереди стояла отметка «до 2026-12-01».\n\nПеренесено из очереди проверок баланса при её упразднении: очередью\nтеперь служит сам бэклог, а прогоны — задачи типа `run`.",
  "status": "benchmark",
  "returnTo": null,
  "priority": 30,
  "createdAt": "2026-08-27T13:49:05+03:00",
  "statusChangedAt": "2026-08-27T22:11:40.147Z",
  "owner": "NB3391",
  "history": [
    {
      "at": "2026-08-27T11:49:15.410Z",
      "from": "new",
      "to": "benchmark",
      "note": "взята в работу машиной NB3391"
    },
    {
      "at": "2026-08-27T14:53:25+03:00",
      "from": "benchmark",
      "to": "new",
      "note": "возвращена в очередь: захвачена при первом живом прогоне, когда исполнение шло мимо раскладки по слотам"
    },
    {
      "at": "2026-08-27T22:11:40.147Z",
      "from": "new",
      "to": "benchmark",
      "note": "взята в работу машиной NB3391"
    }
  ],
  "links": {
    "change": null,
    "pr": null,
    "run": null,
    "related": []
  },
  "attempts": {
    "continuations": 0,
    "cycleFailures": 0
  },
  "run": {
    "kind": "arena",
    "params": {
      "profiles": [
        "baseline-2026-08",
        "baseline-2026-08"
      ],
      "matches": 60,
      "seed": 5000,
      "change": "return-match-to-window"
    },
    "expectation": "доля матчей, упёршихся в предел времени, падает примерно к прежним 16–19 процентам с нынешних 28; медианная длина остаётся в проектной вилке 10–15 минут и НЕ уходит вниз из неё — уход вниз означал бы, что правка глубже задуманного восстановления; доли побед сторон около равных, матч зеркальный. Если доля ничьих не упала, значит связывающее ограничение не запас базы, а невозможность до неё дойти, и лечить надо оборону, а не прочность"
  }
}
