{
  "$schema": "../schema.json",
  "id": "0023-arena-hides-the-nuke-that-never-fired",
  "type": "note",
  "title": "Несостоявшийся ядерный пуск не попадает в ведомость трат",
  "description": "Попытка ядерного пуска не попадает в ведомость трат `attempt` вовсе: на запрос по `spending like '%nuke%'` база арены отвечает пустотой на всех линиях прогона 0001. «Чего не произошло» по ядерке приборами арены не видно, и причину несостоявшегося удара приходится выводить косвенно — через остаток казны по снимкам состояния.\n\nВ разборе 0001 это стоило отдельного скрипта: чтобы объяснить падение числа ударов с 4,48 до 0,17 на матч, пришлось считать долю снимков, в которых казна вообще дотягивает до цены пуска. Прямого ответа «сторона хотела ударить, но не смогла» база не даёт.\n\nЗаметка, а не работа: решать, стоит ли прибор своей цены, должен человек. Возможные исходы — записывать несостоявшуюся попытку в ведомость наравне с состоявшейся; либо признать, что косвенного признака достаточно, и закрыть заметку с этим выводом.\n\nПотеряна и восстановлена вручную: заявка первого живого прогона конвейера пропала из-за порядка действий в `transferReport`, который менял состояние породившей задачи раньше, чем заводил задачи по её заявкам. Текст взят из журнала `manage/journal/0001-tune-the-nuke-tempo.md`.",
  "status": "new",
  "returnTo": null,
  "priority": 60,
  "createdAt": "2026-08-27T18:26:21+03:00",
  "statusChangedAt": "2026-08-27T18:26:21+03:00",
  "owner": null,
  "history": [],
  "links": {
    "change": null,
    "pr": null,
    "run": null,
    "related": [
      "0001-tune-the-nuke-tempo"
    ]
  },
  "attempts": {
    "continuations": 0,
    "cycleFailures": 0
  }
}
