{
  "$schema": "../schema.json",
  "id": "0009-lobby-only-entry",
  "type": "feature",
  "title": "Вход в игру только через лобби, готовые лобби с компьютером убрать",
  "description": "Сейчас в игру можно попасть в обход лобби — кнопками вида «играть с компьютером» и подобными. Их надо убрать все.\n\nОстаётся один вход: кнопка «Новая игра» создаёт лобби. Уже в лобби игрок решает, ждать ли живого противника или добавить компьютерного, и если компьютерного — то какого именно: выбрать стратега или другой профиль.\n\nОтдельно: заранее созданные лобби с компьютером, которые висят в ожидании и занимают ресурсы, надо убрать. Пусть ничего не крутится, пока никто не играет.\n\nЧто выяснить при проработке: какие именно входы существуют сейчас, где они создаются, что именно держат висящие лобби (процессы, память, соединения) и не завязано ли на них что-то ещё — например, быстрый вход для проверок или e2e-тесты.\n\nЗатрагивает `apps/client` (экраны до матча), `apps/server` (лобби и матчмейкинг) и спецификацию `lobby`.",
  "status": "new",
  "returnTo": null,
  "priority": 40,
  "createdAt": "2026-08-27T13:05:00+03:00",
  "statusChangedAt": "2026-08-27T13:05:00+03:00",
  "owner": null,
  "history": [],
  "links": { "change": null, "pr": null, "run": null, "related": ["0010-lobby-password"] },
  "attempts": { "continuations": 0, "cycleFailures": 0 }
}
