{
  "$schema": "../schema.json",
  "id": "0030-razobrat-pochemu-yadernyy-udar-pochti-pe",
  "type": "feature",
  "title": "Разобрать, почему ядерный удар почти перестал запускаться",
  "description": "Прогон 33105088891 (60 матчей, зерно 3000, ревизия 4c2efa1, профили baseline-2026-08 против strategist-2026-08) насчитал четыре принятых ядерных удара на шестьдесят матчей — 0,07 за матч на обе стороны, из них три у Стратега. Для сравнения: предложение к изменению считало 18 ударов на 24 матчах (0,75 за матч, старая карта), а перемер по задаче 0006 после отмены безусловного запаса — 0,35 за матч.\n\nПравка upgrade-nuke-damage-and-radius сократила радиус с десяти клеток до четырёх, то есть площадь поражения примерно вшестеро, и одновременно удвоила прибавку обеих веток прокачки. Похоже, условие «на карте есть скопление, оправдывающее удар» при радиусе четыре почти перестало выполняться: копить компьютерный игрок готов, а цели не находит. Пока удары не случаются, ни удвоенная прокачка, ни новый урон не проверяемы в принципе — любой следующий замер ответит тем же нулём.\n\nЧто выяснить: при каком размере скопления удар считается оправданным сейчас, как это условие соотносится с новым радиусом, и не осталось ли оно откалиброванным под прежние десять клеток.",
  "status": "design",
  "returnTo": null,
  "priority": 20,
  "createdAt": "2026-08-27T19:06:43.730Z",
  "statusChangedAt": "2026-08-28T01:18:44.025Z",
  "owner": "NB3391",
  "history": [
    {
      "at": "2026-08-28T01:18:44.025Z",
      "from": "new",
      "to": "design",
      "note": "взята в работу машиной NB3391"
    }
  ],
  "links": {
    "change": null,
    "pr": null,
    "run": null,
    "related": [
      "0004-nuke-upgrade-strategist-strength"
    ]
  },
  "attempts": {
    "continuations": 2,
    "cycleFailures": 0
  }
}
