{
  "$schema": "../schema.json",
  "id": "0103-behaviour-claims-need-a-control",
  "type": "feature",
  "title": "Утверждение о манере игры проверяется против контроля, а не в одиночку",
  "description": "Проверка «профиль делает X» без контрольного прогона меряет не особенность профиля, а общее свойство игры — и остаётся зелёной, даже если особенность выключить целиком.\n\nСЛУЧАЙ, НА КОТОРОМ ЭТО ВЫЯСНИЛОСЬ. Чиня проверку островов (см. 0102), я взяла на первый взгляд разумную мерку: доля поставленных башен, попавших в радиус острова, должна быть не меньше двух третей. Замер дал 85 процентов, порог проходился с запасом, проверка зеленела.\n\nПотом я прогнала ту же мерку БАЗОВЫМ профилем, у которого островной доктрины нет вовсе. Он дал те же 85 процентов. Мерка не различала наличие доктрины и её отсутствие: острова лежат на вероятном пути, а вдоль пути строят оба профиля. Я едва не поставила вместо молчащей проверки другую молчащую.\n\nРазличил их только сравнительный признак: среднее расстояние между парами поставленных башен — 8,3 клетки у островного против 2,3 у базового. Причём знак оказался ОБРАТНЫМ тому, что утверждала исходная проверка: скоплением строит базовый, у горла подхода, а островной растягивает башни вдоль пути, потому что работа ползёт от ближнего острова к дальнему.\n\nЧТО ДОЛЖНО СТАТЬ. Помощник, прогоняющий тот же сценарий с контрольным профилем и требующий РАЗНИЦЫ, а не абсолютного значения:\n\n    expectDistinguishes({ profile: ISLANDS_PROFILE, control: BASELINE_PROFILE, measure: разбросБашен, atLeast: 2 });\n\nПрименять не везде — он стоит второго матча на проверку. Только к утверждениям о манере игры: доктрины профилей, осадное поведение, порядок трат.\n\nКАК ПОНЯТЬ, ЧТО СДЕЛАНО. Каждое утверждение о манере игры в `packages/ai/src/*.match.test.ts` либо идёт через контроль, либо проверяет механизм напрямую (как это сделано в проверке порядка обхода островов — она спрашивает `islandAim`, а не расположение башен). Проверок, утверждающих абсолютное число про поведение профиля, не остаётся.\n\nПОБОЧНАЯ ПОЛЬЗА. Сравнительные мерки не разъезжаются от правок баланса. Абсолютные разъезжаются от каждой: именно поэтому проверка островов падала на изменении запаса базы, к которому не имела никакого отношения.",
  "status": "new",
  "returnTo": null,
  "priority": 30,
  "createdAt": "2026-08-27T13:39:44+03:00",
  "statusChangedAt": "2026-08-27T13:39:44+03:00",
  "owner": null,
  "history": [],
  "links": {
    "change": null,
    "pr": null,
    "run": null,
    "related": ["0102-no-vacuous-count-assertions", "0104-scenario-declares-its-ending"]
  },
  "attempts": { "continuations": 0, "cycleFailures": 0 }
}
