{
  "$schema": "../schema.json",
  "id": "0026-treasury-never-affords-the-nuke",
  "type": "feature",
  "title": "Казна не дорастает до цены ядерного удара: 0,13 % снимков против 55,8 %",
  "description": "Разобрать, почему на нынешней главной ветке ядерный удар практически исчез из игры, и вернуть его в матч.\n\nЧисла из прогона 0001 (арена, три линии по 60 матчей, зерно 7100, зеркальная пара strategist-2026-08). Доля снимков состояния, в которых стороне хватает казны на пуск (12000 внутренних единиц):\n\n| линия | ревизия | доля снимков | средний остаток казны |\n| --- | --- | --- | --- |\n| до ядерной правки | `6cfa598` | 51,5 % | 7998 |\n| сразу после (PR #28) | `34be09d` | 55,8 % | 8321 |\n| сейчас | `7d1cec4` | **0,13 %** | **1309** |\n\nУдаров на матч при этом 4,48 → 1,68 → 0,17: десять ударов на шестьдесят матчей, ударяли девять сторон из ста двадцати.\n\nВиновата не ядерная правка, а то, что влилось после неё: между `34be09d` и `7d1cec4` два десятка слияний, крупно задевших `packages/ai`, `packages/sim` и `packages/shared` (+2984 строки). Казна разбирается досуха на дешёвое и до цены удара не дорастает почти никогда. Ветка прокачки ядерки, ради окупаемости которой правка «tune-the-nuke» и делалась, в матче не проявляется вовсе.\n\nЕсть родственная запись в памяти проекта: «Прибор арены не может позволить себе дорогую ветку» — казна не дорастает до 240, потому что дешёвое разбирает её дважды в секунду. Скорее всего это тот же механизм, доросший до ядерной цены; проверить в первую очередь.\n\nЧто нужно сделать:\n\n1. Найти правку (или сумму правок) между `34be09d` и `7d1cec4`, после которой остаток казны просел вшестеро. Линии восстанавливаются тегами `bench-0001-before` и `bench-0001-after-nuke`, обе ревизии доступны кнопкой в Actions;\n2. Решить, чинить ли это правилом покупки у профиля (копить под дорогое) или ценами, и обосновать выбор в `design.md`;\n3. Прогон после правки заказать задачей `run` тем же PR: без него «починилось» проверить нечем.\n\nПотеряна и восстановлена вручную: заявка первого живого прогона конвейера пропала из-за порядка действий в `transferReport`, который менял состояние породившей задачи раньше, чем заводил задачи по её заявкам. Текст взят из журнала `manage/journal/0001-tune-the-nuke-tempo.md`.",
  "status": "design",
  "returnTo": null,
  "priority": 10,
  "createdAt": "2026-08-27T18:26:21+03:00",
  "statusChangedAt": "2026-08-28T00:31:11.562Z",
  "owner": "NB3391",
  "history": [
    {
      "at": "2026-08-28T00:31:11.562Z",
      "from": "new",
      "to": "design",
      "note": "взята в работу машиной NB3391"
    }
  ],
  "links": {
    "change": null,
    "pr": null,
    "run": null,
    "related": [
      "0001-tune-the-nuke-tempo"
    ]
  },
  "attempts": {
    "continuations": 0,
    "cycleFailures": 0
  }
}
