{
  "$schema": "../schema.json",
  "id": "0024-strategist-length-tail-remeasure",
  "type": "run",
  "title": "Перезамер хвоста длины матча на паре стратегов после починки казны",
  "description": "Доля ничьих по времени на зеркальной паре strategist-2026-08 выросла втрое: 5,0 % на `6cfa598`, 11,7 % на `34be09d`, 16,7 % на `7d1cec4`. Девяностая доля длины упёрлась в потолок 20:00 на обеих поздних линиях, тогда как до правки была 19:16. Медиана всё это время оставалась в проектной вилке (13:34 / 13:05 / 13:37) — то есть портится не середина, а хвост.\n\n**Прогон осмыслен только после того, как задача `0022` доведена до главной ветки.** Хвост тяжелеет ровно на тех же двух десятках слияний, на которых просела казна, и мерить его до починки — значит переснять уже снятое. Проверить состояние `0022` перед началом: если она не `closed`, увести задачу в `awaiting-po` с вопросом владельцу продукта, гонять ли всё равно, а не запускать по своему усмотрению.\n\nЗачем отдельно от `0015` и `0016`: те меряют возврат длины на паре `baseline-2026-08` после уменьшения запаса базы. Здесь другая пара профилей, другое зерно и другой повод — важно независимое свидетельство, а не повторение той же настройки.\n\nЛинии сравнения восстанавливаются лёгкими тегами `bench-0001-before` (`6cfa598`) и `bench-0001-after-nuke` (`34be09d`): кнопка Actions наводится только на ветку или тег, на голый SHA API отвечает 422. Когда этот перезамер сделан, теги больше не нужны — снимаются командой `git push origin --delete bench-0001-before bench-0001-after-nuke`.\n\nПотеряна и восстановлена вручную. Конвейер отверг эту заявку справедливо: в ней не было ожидаемого результата, а без него прогон нечем истолковать. Здесь оно записано. Текст взят из журнала `manage/journal/0001-tune-the-nuke-tempo.md`.",
  "status": "new",
  "returnTo": null,
  "priority": 90,
  "createdAt": "2026-08-27T18:26:21+03:00",
  "statusChangedAt": "2026-08-27T18:26:21+03:00",
  "owner": null,
  "history": [],
  "links": {
    "change": null,
    "pr": null,
    "run": null,
    "related": [
      "0001-tune-the-nuke-tempo",
      "0022-treasury-never-affords-the-nuke"
    ]
  },
  "attempts": {
    "continuations": 0,
    "cycleFailures": 0
  },
  "run": {
    "kind": "arena",
    "params": {
      "profiles": [
        "strategist-2026-08",
        "strategist-2026-08"
      ],
      "matches": 60,
      "seed": 7100,
      "change": "0022-treasury-never-affords-the-nuke"
    },
    "expectation": "доля ничьих по времени возвращается к прежним 5 % и во всяком случае не выше 10 %; девяностая доля длины отходит от потолка 20:00 — упирание в потолок означает, что матчи не доигрываются, а обрываются; медиана остаётся в проектной вилке 10–15 минут и НЕ уходит вниз из неё: уход вниз означал бы, что починка казны сделала удар слишком доступным. Доли побед около равных — матч зеркальный и об усилении не говорит ничего. Если доля ничьих не упала, значит хвост держит не казна, а невозможность дойти до базы, и разбираться надо с обороной"
  }
}
