{
  "$schema": "../schema.json",
  "id": "0023-drop-the-synthetic-nuke-whistle",
  "type": "feature",
  "title": "Убрать посчитанный свист снижающейся ядерной ракеты: он звучит неестественно",
  "description": "ЧТО ПРОСИЛ ВЛАДЕЛЕЦ ПРОДУКТА. Сперва: «у ядерной ракеты надо убрать звук, он неестественный». Затем, увидев разбор: «звука сейчас нет в семплах, надо убрать звук вообще сейчас, а потом добавим нормальный».\n\nНаблюдение про семплы верное и совпадает с проверкой: записи под свист нет вовсе. Отсюда и решение владельца — не приглушить, не подобрать замену на ходу, а убрать.\n\nО КАКОМ ЗВУКЕ РЕЧЬ. Звуков у ядерного удара два, и убрать надо ПЕРВЫЙ из них.\n\n1. `Sound.NukeFall` — «свист снижающейся ядерной ракеты», три секунды, ровно `NUKE_DELAY_TICKS`. Он ПОСЧИТАН на лету: `renderNukeFall` в `apps/client/src/audio/sounds.ts` ведёт тон с 1700 до 250 герц, подмешивает полосу шума и вибрато в полтора процента. Записи под него нет — вот те самые «нет в семплах». Это тот самый звук.\n\n2. `Sound.NukeBlast` — сам удар. Это ЗАПИСЬ, `apps/client/src/audio/assets/nuke-blast.mp3`, семь секунд с затуханием. Его НЕ трогать: жалоба была на подлёт, а не на попадание, и семпл у попадания как раз есть.\n\nЧТО ДОЛЖНО СТАТЬ. Свист снижающейся ракеты не звучит вовсе. Молчание здесь лучше неправдоподобного свиста: он тянется три секунды подряд поверх самого напряжённого момента матча, и фальшь в нём слышно тем отчётливее, чем важнее событие.\n\nЧТО ПРИ ЭТОМ НЕ СЛОМАТЬ. `NukeFall` — не одна строка, он размечен по всей звуковой подсистеме: `SOUND_SECONDS`, `SOUND_PEAK`, `SOUND_PRIORITY` (90 — второй по важности после самого удара), `VARIANTS`, `LOOPING` в `sounds.ts`; пул `Pool.Nuke` с лимитом на два места в `apps/client/src/audio/budget.ts`; очередь выпечки в `bake.worker.ts`; выдача сигнала по `world.nukes` в `cues.ts`. Есть и проверки, прямо называющие состав пула: `budget.test.ts` требует, чтобы в пуле `Nuke` лежали ровно `NukeBlast` и `NukeFall`, а лимит пула равнялся числу звуков в нём. Их придётся править вместе с таблицами — и это не признак того, что задача сделана неправильно, а признак того, что состав звуков объявлен в одном месте и проверяется.\n\nКАК ИМЕННО ВЫЧЕРКНУТЬ — РЕШАЕТ СЕССИЯ. Выбор между «убрать звук из перечисления и всех таблиц» и «оставить запись, но не выдавать сигнал» технический, и вопросом владельцу не является. Но решать его надо с оглядкой на обещанное: владелец сказал «потом добавим нормальный», то есть возврат звука записью — дело решённое, а не гипотеза. Путь, по которому возврат обойдётся в одну строку и файл, предпочтительнее того, где придётся заново вписывать звук в семь таблиц. Выбор обосновать в проектном решении.\n\nЧТО ЭТА ПРАВКА ОТНИМАЕТ У ИГРОКА, И ЭТО ВАЖНО. Свист был ЕДИНСТВЕННЫМ предупреждением о чужом ударе, когда тот летит в невидимую сейчас часть поля: игрок видит за раз около трети карты, а `NUKE_DELAY_TICKS` даёт на реакцию три секунды. Убрав звук, мы отнимаем повод посмотреть. Поэтому задача 0024 — отметка удара на миникарте — не украшение, а замена отнятого, и брать её следует не позже этой.\n\nКАК ПОНЯТЬ, ЧТО СДЕЛАНО. В матче с ядерным ударом за три секунды до попадания не появляется нового звука; сам удар звучит по-прежнему. Проверка звуковых сигналов не требует свиста и не падает от его отсутствия.\n\nСВЯЗЬ. Задача 0025 — напоминание владельцу подобрать настоящую запись. Пока записи нет, ракета подлетает молча.",
  "status": "new",
  "returnTo": null,
  "priority": 50,
  "createdAt": "2026-08-27T18:21:00+03:00",
  "statusChangedAt": "2026-08-27T18:21:00+03:00",
  "owner": null,
  "history": [],
  "links": {
    "change": null,
    "pr": null,
    "run": null,
    "related": ["0024-minimap-shows-the-incoming-nuke", "0025-find-a-real-nuke-fall-recording"]
  },
  "attempts": { "continuations": 0, "cycleFailures": 0 }
}
