{
  "$schema": "../schema.json",
  "id": "0101-noise-aware-balance-thresholds",
  "type": "feature",
  "title": "Пороги проверки баланса должны считаться от разброса, а не быть константами",
  "description": "Сейчас `scripts/balance-run.mjs` объявляет сдвиг по постоянным порогам: `WIN_SHARE_STEP = 0.05`, `LENGTH_STEP = 0.1`, `REASON_SHARE_STEP = 0.1`. Ни один из них не знает, сколько было матчей и насколько широко распределена измеряемая величина.\n\nДлина матча распределена ДВУГОРБО: часть партий кончается прорывом на третьей минуте, часть досиживает до двадцатиминутного потолка. От десятой до девяностой доли выходит 2:30–20:00 при медиане около тринадцати. На шестидесяти матчах медиана из такого распределения гуляет на минуты сама по себе.\n\nОтсюда две беды сразу, и вторая хуже первой.\n\nЛОЖНАЯ ТРЕВОГА: сдвиг медианы на десятую долю укладывается в шум, но порог его объявляет расхождением и заводит Issue. Разбирать такое приходится человеку.\n\nЛОЖНОЕ СПОКОЙСТВИЕ: настоящий сдвиг МЕНЬШЕ порога джоба не заметит вовсе, сколько бы матчей ни прогнала. Увеличение серии сейчас не повышает чувствительность — порог-то постоянный.\n\nЗамер, показавший это: развёртка по прочности базы 26.08.2026. На двадцати матчах на уровень ряд вышел немонотонным (×0,6 медленнее ×0,7, ×0,9 медленнее ×1), и буквальное прочтение дало бы вывод «рычаг не работает». На сотне матчей ряд выпрямился и по медиане, и по доле ничьих. Числа — в `scripts/experiment/results.md`.\n\nЧТО ДОЛЖНО СТАТЬ. Сдвиг сравнивается с собственной ошибкой величины, а не с константой. Ошибка считается по выборке того же прогона (для доли — по биномиальной, для медианы — бутстрапом либо по разбросу выборки). Расхождением считается то, что превышает ошибку заметно — во сколько именно раз, решить в замысле; в факторном переборе я брала «меньше двух ошибок — говорить не о чем, больше трёх — значимо».\n\nОшибка ПЕЧАТАЕТСЯ в Issue рядом с числом. Тогда человек читает не «медиана выросла на 14 процентов», а «выросла на 14 при ошибке 6» — и сам видит, спорить тут или чинить.\n\nКАК ПОНЯТЬ, ЧТО СДЕЛАНО. Прогон на заведомо одинаковых данных (одна и та же настройка дважды) даёт ноль расхождений. Прогон, где величина изменена заведомо сильно, расхождение объявляет. Ни одно сообщение о сдвиге не выходит без ошибки рядом с числом.\n\nПОБОЧНО СТОИТ ПОСМОТРЕТЬ: сейчас число матчей у записи задаёт автор записи наугад. Зная ошибку, можно подсказывать нужную серию — «чтобы поймать сдвиг в минуту, нужно N матчей».",
  "status": "new",
  "returnTo": null,
  "priority": 10,
  "createdAt": "2026-08-27T13:39:44+03:00",
  "statusChangedAt": "2026-08-27T13:39:44+03:00",
  "owner": null,
  "history": [],
  "links": {
    "change": null,
    "pr": null,
    "run": null,
    "related": ["0102-no-vacuous-count-assertions", "0105-mutation-canary-run"]
  },
  "attempts": { "continuations": 0, "cycleFailures": 0 }
}
