{
  "$schema": "../schema.json",
  "id": "0008-unit-range-upgrade",
  "type": "run",
  "title": "Работает ли прокачка дальности снайпера и Теслы",
  "description": "дальность снайпера и Теслы стала прокачиваемой — прежде она была единственной характеристикой, которую им улучшить нельзя, а дальность башни при этом росла. Двух уровней башенной дальности хватало, чтобы обычная башня начала перестреливать Теслу, и стоили они тринадцать секунд дохода. Теперь гонка двусторонняя, и вопрос ровно один: доходит ли осадная машина до цели чаще, чем прежде, или дорогая ветка просто съедает деньги, на которые куплено бы войско. Рассуждением это не выводится: у дальности пороговый эффект — стрелок либо вне круга ответного огня, либо в нём, — и на исход он ложится скачком, а не пропорцией. Профиль long-range-2026-08 заведён ровно под этот замер: обычные профили дальность не покупают вовсе (внутри цели берётся самая дешёвая ветка, а дальность вчетверо дороже прочих), и на них замер показал бы ноль\n\nЗамер заказан по изменению «add-unit-range-upgrade».\nВ очереди стояла отметка «до 2026-12-01».\n\nПеренесено из очереди проверок баланса `balance/queue.json` при её упразднении:\nочередью теперь служит сам бэклог, а прогоны — задачи типа `run`.",
  "status": "benchmark",
  "returnTo": null,
  "priority": 30,
  "createdAt": "2026-08-27T13:32:34+03:00",
  "statusChangedAt": "2026-08-27T20:01:28.406Z",
  "owner": "NB3391",
  "history": [
    {
      "at": "2026-08-27T11:49:15.410Z",
      "from": "new",
      "to": "benchmark",
      "note": "взята в работу машиной NB3391"
    },
    {
      "at": "2026-08-27T14:53:25+03:00",
      "from": "benchmark",
      "to": "new",
      "note": "возвращена в очередь: захвачена при первом живом прогоне, когда исполнение шло мимо раскладки по слотам"
    },
    {
      "at": "2026-08-27T20:01:28.406Z",
      "from": "new",
      "to": "benchmark",
      "note": "взята в работу машиной NB3391"
    }
  ],
  "links": {
    "change": null,
    "pr": null,
    "run": null,
    "related": []
  },
  "attempts": {
    "continuations": 0,
    "cycleFailures": 0
  },
  "run": {
    "kind": "arena",
    "params": {
      "profiles": [
        "baseline-2026-08",
        "long-range-2026-08"
      ],
      "matches": 60,
      "seed": 4300,
      "change": "add-unit-range-upgrade"
    },
    "expectation": "Смотреть надо на ПОВЕДЕНИЕ, а не на доли побед, и это не отговорка, а свойство прибора. Профиль long-range слаб в средней фазе: она копит доход вместо того, чтобы усиливать войско. На пяти пробных мирах покупки дальности случились в трёх — там, где матч дожил до поздней фазы (до 8 уровней снайпера и 5 Теслы), — а в двух его снесли на четвёртой минуте, то есть доли побед меряют слабость средней фазы, а не силу веток. Ждём: у long-range доля потерянных Тесл ниже, чем у базового, а снятых вражеских башен на одну Теслу — выше; медиана матча остаётся в проектной вилке 10–15 минут; доля матчей, упёршихся в предел времени, не растёт. Если Теслы гибнут не реже прежнего, ветка дальности не работает как задумано, и виновата либо цена, либо то, что противник останавливается не там, где достаёт"
  }
}
