{
  "$schema": "../schema.json",
  "id": "0012-energy-for-kills",
  "type": "feature",
  "title": "Экономика: энергия за убийства башнями и генералами",
  "description": "Добавить награду за убийство: башня или генерал, уничтожившие вражеского юнита, приносят энергию. Предложенное значение — 5 за убийство.\n\n**Число подлежит разбору, а не принятию на веру.** Владелец продукта прямо сказал: «5 за убийство, но лучше проанализируй, может стоит и больше». При проработке посчитать, что 5 означают в нынешней экономике: какова доля этой награды в общем доходе за матч, во сколько обходится юнит, сколько убийств происходит за среднюю партию. Если награда теряется в шуме дохода — она ничего не изменит, и добавлять её незачем; если сравнима с ценой юнита — оборона начнёт окупать себя, а это уже другая игра.\n\nЧего опасаться и назвать в не-целях: награда за убийство усиливает того, кто и так побеждает, — у выигрывающего больше живых башен и больше убийств. Такая обратная связь укорачивает матчи и делает отставание безнадёжным. Проверить это придётся прогоном, а не рассуждением.\n\nПравка задевает правила игры, поэтому: обновить эталон детерминизма тем же коммитом и завести задачу на прогон арены — сравнить длину матча, доли побед и долю матчей, упёршихся в предел времени, с нынешними.\n\nЗатрагивает `packages/sim` (начисление), `packages/shared` (константа награды), спецификации `combat` и `economy-upgrades`.\n\n**Появилось в главной ветке.** Модуль `packages/shared/src/rules.ts` завёл\nмножители правил, применяемые один раз при запуске, а `scripts/experiment/`\nумеет гонять по ним факторный замер. Это прямо относится к вопросу «может\nстоит и больше»: величину награды разумно не выбирать рассуждением,\nа развернуть замером по нескольким уровням — так же, как выбирали запас базы.\n\nМножителя под награду за убийство там пока нет — если решат мерить,\nего придётся завести седьмым.",
  "status": "failed",
  "returnTo": "design",
  "priority": 40,
  "createdAt": "2026-08-27T13:05:00+03:00",
  "statusChangedAt": "2026-08-28T07:37:35.086Z",
  "owner": "NB3391",
  "history": [
    {
      "at": "2026-08-28T05:06:47.621Z",
      "from": "new",
      "to": "design",
      "note": "взята в работу машиной NB3391"
    },
    {
      "at": "2026-08-28T07:37:35.086Z",
      "from": "design",
      "to": "failed",
      "note": "молчит дольше отпущенного"
    }
  ],
  "links": {
    "change": null,
    "pr": null,
    "run": null,
    "related": []
  },
  "attempts": {
    "continuations": 2,
    "cycleFailures": 0
  }
}
