{
  "$schema": "../schema.json",
  "id": "0010-lobby-password",
  "type": "feature",
  "title": "Пароль на лобби, чтобы не зашёл кто попало",
  "description": "В лобби нужна возможность задать пароль при создании. Без пароля лобби открыто, как сейчас; с паролем войти можно только зная его.\n\nЧто выяснить при проработке: где пароль проверяется. Проверять его обязан сервер, а не клиент: проверка на клиенте не защищает ни от чего, потому что в лобби стучатся напрямую по сети. Хранить пароль в открытом виде в состоянии лобби тоже не годится — надо решить, хранить ли хеш и какой.\n\nОтдельный вопрос к проработке: что видит игрок, попавший в список лобби, — видно ли, что лобби под паролем, до попытки входа. Скорее да: иначе он будет тыкаться вслепую.\n\nЗатрагивает `apps/client` (создание и вход), `apps/server` (лобби), спецификацию `lobby`, и, возможно, `packages/protocol` — если для пароля нужно новое поле в сообщении, раскладка байтов меняется и версия протокола растёт.",
  "status": "design",
  "returnTo": null,
  "priority": 40,
  "createdAt": "2026-08-27T13:05:00+03:00",
  "statusChangedAt": "2026-08-27T11:51:39.317Z",
  "owner": "NB3391",
  "history": [
    {
      "at": "2026-08-27T11:51:39.317Z",
      "from": "new",
      "to": "design",
      "note": "взята в работу машиной NB3391"
    }
  ],
  "links": {
    "change": null,
    "pr": null,
    "run": null,
    "related": [
      "0009-lobby-only-entry"
    ]
  },
  "attempts": {
    "continuations": 0,
    "cycleFailures": 0
  }
}
