{
  "$schema": "../schema.json",
  "id": "0007-fortify-approaches-strength",
  "type": "run",
  "title": "Сила осадного профиля после правки размещения башен",
  "description": "место под башню выбирается теперь не по одному покрытию ещё не накрытого пути, а вместе с прибавкой к живучести от взаимного прикрытия. Башни перестали расталкиваться — 7,6 клетки между своими против 9,1, — но зеркальный прогон на seed 2000-2019 об усилении не говорит ничего: обе стороны играют одинаково. Зонд осадного профиля против базового намекает, что противник стал живучее (18 заказов Теслы на пяти мирах против трёх), но зонд это пять матчей, а не шестьдесят\n\nЗамер заказан по изменению «fortify-approaches».\nВ очереди стояла отметка «до 2026-11-01».\n\nПеренесено из очереди проверок баланса `balance/queue.json` при её упразднении:\nочередью теперь служит сам бэклог, а прогоны — задачи типа `run`.",
  "status": "benchmark",
  "returnTo": null,
  "priority": 30,
  "createdAt": "2026-08-27T13:32:34+03:00",
  "statusChangedAt": "2026-08-27T19:56:26.128Z",
  "owner": "NB3391",
  "history": [
    {
      "at": "2026-08-27T11:49:15.410Z",
      "from": "new",
      "to": "benchmark",
      "note": "взята в работу машиной NB3391"
    },
    {
      "at": "2026-08-27T14:53:25+03:00",
      "from": "benchmark",
      "to": "new",
      "note": "возвращена в очередь: захвачена при первом живом прогоне, когда исполнение шло мимо раскладки по слотам"
    },
    {
      "at": "2026-08-27T19:56:26.128Z",
      "from": "new",
      "to": "benchmark",
      "note": "взята в работу машиной NB3391"
    }
  ],
  "links": {
    "change": null,
    "pr": null,
    "run": null,
    "related": []
  },
  "attempts": {
    "continuations": 0,
    "cycleFailures": 0
  },
  "run": {
    "kind": "arena",
    "params": {
      "profiles": [
        "baseline-2026-08",
        "siege-2026-08"
      ],
      "matches": 60,
      "seed": 2000,
      "change": "fortify-approaches"
    },
    "expectation": "осадный профиль не должен проигрывать базовому чаще, чем в двух третях матчей: правка размещения обязана помогать обоим одинаково, а не одному. Медиана матча остаётся в проектной вилке 10-15 минут — зеркальный прогон дал 13:43, доля ничьих упала с 35% до 15%, и это стоит подтвердить на разных профилях. Профили намеренно РАЗНЫЕ: вопрос здесь о силе"
  }
}
